g11877,Q06124,PTN11_HUMAN,PTN11_HUMAN,Tyrosine-protein phosphatase non-receptor type 11 (EC 3.1.3.48) (Protein-tyrosine phosphatase 1D) (PTP-1D) (Protein-tyrosine phosphatase 2C) (PTP-2C) (SH-PTP2) (SHP-2) (Shp2) (SH-PTP3),PTPN11 PTP2C SHPTP2,atrioventricular canal development [GO:0036302]; axonogenesis [GO:0007409]; Bergmann glial cell differentiation [GO:0060020]; brain development [GO:0007420]; cellular response to epidermal growth factor stimulus [GO:0071364]; cerebellar cortex formation [GO:0021697]; cytokine-mediated signaling pathway [GO:0019221]; DNA damage checkpoint signaling [GO:0000077]; ephrin receptor signaling pathway [GO:0048013]; epidermal growth factor receptor signaling pathway [GO:0007173]; ERBB signaling pathway [GO:0038127]; face morphogenesis [GO:0060325]; fibroblast growth factor receptor signaling pathway [GO:0008543]; genitalia development [GO:0048806]; glucose homeostasis [GO:0042593]; heart development [GO:0007507]; homeostasis of number of cells within a tissue [GO:0048873]; hormone metabolic process [GO:0042445]; hormone-mediated signaling pathway [GO:0009755]; inner ear development [GO:0048839]; integrin-mediated signaling pathway [GO:0007229]; intestinal epithelial cell migration [GO:0061582]; megakaryocyte development [GO:0035855]; microvillus organization [GO:0032528]; multicellular organism growth [GO:0035264]; multicellular organismal reproductive process [GO:0048609]; negative regulation of cell adhesion mediated by integrin [GO:0033629]; negative regulation of chondrocyte differentiation [GO:0032331]; negative regulation of cortisol secretion [GO:0051463]; negative regulation of growth hormone secretion [GO:0060125]; negative regulation of insulin secretion [GO:0046676]; negative regulation of type I interferon production [GO:0032480]; neurotrophin TRK receptor signaling pathway [GO:0048011]; organ growth [GO:0035265]; peptidyl-tyrosine dephosphorylation [GO:0035335]; platelet formation [GO:0030220]; platelet-derived growth factor receptor signaling pathway [GO:0048008]; positive regulation of ERK1 and ERK2 cascade [GO:0070374]; positive regulation of glucose import [GO:0046326]; positive regulation of hormone secretion [GO:0046887]; positive regulation of insulin receptor signaling pathway [GO:0046628]; positive regulation of interferon-beta production [GO:0032728]; positive regulation of interleukin-6 production [GO:0032755]; positive regulation of mitotic cell cycle [GO:0045931]; positive regulation of ossification [GO:0045778]; positive regulation of peptidyl-tyrosine phosphorylation [GO:0050731]; positive regulation of tumor necrosis factor production [GO:0032760]; protein dephosphorylation [GO:0006470]; regulation of cell adhesion mediated by integrin [GO:0033628]; regulation of protein export from nucleus [GO:0046825]; regulation of protein-containing complex assembly [GO:0043254]; regulation of type I interferon-mediated signaling pathway [GO:0060338]; T cell costimulation [GO:0031295]; triglyceride metabolic process [GO:0006641],GO:0000077; GO:0001784; GO:0004721; GO:0004725; GO:0004726; GO:0005158; GO:0005634; GO:0005654; GO:0005737; GO:0005829; GO:0006470; GO:0006641; GO:0007173; GO:0007229; GO:0007409; GO:0007420; GO:0007507; GO:0008543; GO:0009755; GO:0019221; GO:0019901; GO:0021697; GO:0030159; GO:0030220; GO:0030971; GO:0031295; GO:0032331; GO:0032480; GO:0032528; GO:0032728; GO:0032755; GO:0032760; GO:0032991; GO:0033628; GO:0033629; GO:0035264; GO:0035265; GO:0035335; GO:0035855; GO:0036302; GO:0038127; GO:0042445; GO:0042593; GO:0043254; GO:0045296; GO:0045778; GO:0045931; GO:0046326; GO:0046628; GO:0046676; GO:0046825; GO:0046887; GO:0048008; GO:0048011; GO:0048013; GO:0048609; GO:0048806; GO:0048839; GO:0048873; GO:0050731; GO:0050839; GO:0051428; GO:0051463; GO:0060020; GO:0060090; GO:0060125; GO:0060325; GO:0060338; GO:0061582; GO:0070374; GO:0071364; GO:1990782,404,603,615,415,1116,581,492,728,994,2155,262,751,968,415,331,1421,1023,580,724,887,969,854,824,432,541,510,203,402
g9996,P12606,ITB1A_XENLA,ITB1A_XENLA,Integrin beta-1-A,itgb1-a,cell adhesion [GO:0007155]; integrin-mediated signaling pathway [GO:0007229]; muscle organ development [GO:0007517]; myoblast differentiation [GO:0045445]; myoblast fusion [GO:0007520],GO:0007155; GO:0007229; GO:0007517; GO:0007520; GO:0030027; GO:0032154; GO:0032587; GO:0042470; GO:0045445; GO:0046872; GO:0070161,10080,17721,26349,28480,23265,22869,24111,26354,10662,6738,6897,6969,6380,2417,1831,3811,3679,1549,3096,3208,3060,3477,17875,14556,17055,13881,18433,10533
g9995,Q00651,ITA4_MOUSE,ITA4_MOUSE,Integrin alpha-4 (CD49 antigen-like family member D) (Integrin alpha-IV) (Lymphocyte Peyer patch adhesion molecules subunit alpha) (LPAM subunit alpha) (VLA-4 subunit alpha) (CD antigen CD49d),Itga4,axonogenesis involved in innervation [GO:0060385]; blood vessel remodeling [GO:0001974]; cell adhesion [GO:0007155]; cell adhesion mediated by integrin [GO:0033627]; cell migration [GO:0016477]; cell-cell adhesion [GO:0098609]; cell-matrix adhesion [GO:0007160]; chorio-allantoic fusion [GO:0060710]; clathrin-dependent extracellular exosome endocytosis [GO:1990771]; diapedesis [GO:0050904]; face development [GO:0060324]; heart development [GO:0007507]; heterophilic cell-cell adhesion via plasma membrane cell adhesion molecules [GO:0007157]; import into cell [GO:0098657]; integrin-mediated signaling pathway [GO:0007229]; leukocyte cell-cell adhesion [GO:0007159]; mesenchyme development [GO:0060485]; negative regulation of protein homodimerization activity [GO:0090074]; negative regulation of vasoconstriction [GO:0045906]; neuron projection extension [GO:1990138]; pericyte cell migration [GO:1905351]; positive regulation of leukocyte cell-cell adhesion [GO:1903039]; positive regulation of leukocyte migration [GO:0002687]; positive regulation of leukocyte tethering or rolling [GO:1903238]; positive regulation of T cell migration [GO:2000406]; T cell migration [GO:0072678]; vascular associated smooth muscle cell migration [GO:1904738]; visceral serous pericardium development [GO:0061032],GO:0001968; GO:0001974; GO:0002687; GO:0003823; GO:0005178; GO:0005911; GO:0007155; GO:0007157; GO:0007159; GO:0007160; GO:0007229; GO:0007507; GO:0008305; GO:0009897; GO:0009986; GO:0016477; GO:0030426; GO:0033627; GO:0034668; GO:0043025; GO:0045906; GO:0046872; GO:0050839; GO:0050904; GO:0060324; GO:0060385; GO:0060485; GO:0060710; GO:0061032; GO:0072678; GO:0090074; GO:0098609; GO:0098657; GO:1903039; GO:1903238; GO:1904738; GO:1905351; GO:1990138; GO:1990405; GO:1990771; GO:2000406,379,569,585,1205,529,908,821,1103,322,104,73,207,112,10,149,77,59,26,91,26,75,9,1235,696,740,897,207,339
g9994,Q13797,ITA9_HUMAN,ITA9_HUMAN,Integrin alpha-9 (Integrin alpha-RLC),ITGA9,cell adhesion [GO:0007155]; cell adhesion mediated by integrin [GO:0033627]; cell-cell adhesion [GO:0098609]; cell-matrix adhesion [GO:0007160]; integrin-mediated signaling pathway [GO:0007229]; negative regulation of vasoconstriction [GO:0045906]; neutrophil chemotaxis [GO:0030593],GO:0005178; GO:0005886; GO:0007155; GO:0007160; GO:0007229; GO:0008305; GO:0009897; GO:0009925; GO:0030593; GO:0033627; GO:0034679; GO:0045906; GO:0046872; GO:0098609; GO:0098640,506,893,1208,1495,709,1521,1431,1942,584,185,194,338,141,37,222,81,84,21,205,90,174,19,2112,1280,1229,1538,243,787
g18407,Q9DF58,ILK_CHICK,ILK_CHICK,Integrin-linked protein kinase (EC 2.7.11.1) (59 kDa serine/threonine-protein kinase) (Beta-integrin-linked kinase) (ILK-1) (ILK-2) (p59ILK),ILK ILK1 ILK2,branching involved in ureteric bud morphogenesis [GO:0001658]; cell morphogenesis [GO:0000902]; cell projection organization [GO:0030030]; establishment or maintenance of epithelial cell apical/basal polarity [GO:0045197]; fibroblast migration [GO:0010761]; integrin-mediated signaling pathway [GO:0007229]; myelination in peripheral nervous system [GO:0022011]; negative regulation of neural precursor cell proliferation [GO:2000178]; nerve development [GO:0021675]; neural precursor cell proliferation [GO:0061351]; outflow tract morphogenesis [GO:0003151]; phosphatidylinositol 3-kinase/protein kinase B signal transduction [GO:0043491]; positive regulation of BMP signaling pathway [GO:0030513]; positive regulation of canonical NF-kappaB signal transduction [GO:0043123]; positive regulation of canonical Wnt signaling pathway [GO:0090263]; positive regulation of cell population proliferation [GO:0008284]; positive regulation of DNA-templated transcription [GO:0045893]; positive regulation of osteoblast differentiation [GO:0045669]; positive regulation of protein phosphorylation [GO:0001934]; positive regulation of substrate adhesion-dependent cell spreading [GO:1900026]; signal transduction [GO:0007165]; substrate adhesion-dependent cell spreading [GO:0034446]; tumor necrosis factor-mediated signaling pathway [GO:0033209],GO:0000902; GO:0001658; GO:0001934; GO:0003151; GO:0004672; GO:0004674; GO:0005524; GO:0005737; GO:0005829; GO:0005886; GO:0005925; GO:0007165; GO:0007229; GO:0008284; GO:0010761; GO:0019901; GO:0021675; GO:0022011; GO:0030017; GO:0030027; GO:0030030; GO:0030513; GO:0033209; GO:0034446; GO:0043123; GO:0043491; GO:0045197; GO:0045669; GO:0045893; GO:0061351; GO:0090263; GO:1900026; GO:2000178,1103,1955,2732,1548,2464,1972,2466,1632,348,388,247,334,399,446,174,419,228,240,667,880,208,88,2762,2018,1659,1235,4322,1283
g10318,B8JK39,ITA9_MOUSE,ITA9_MOUSE,Integrin alpha-9,Itga9,cell adhesion [GO:0007155]; cell adhesion mediated by integrin [GO:0033627]; cell-cell adhesion [GO:0098609]; cell-matrix adhesion [GO:0007160]; integrin-mediated signaling pathway [GO:0007229]; negative regulation of vasoconstriction [GO:0045906]; neutrophil chemotaxis [GO:0030593],GO:0005178; GO:0005518; GO:0007155; GO:0007160; GO:0007229; GO:0008305; GO:0009897; GO:0009925; GO:0030593; GO:0033627; GO:0034679; GO:0043236; GO:0045906; GO:0046872; GO:0098609; GO:0098640,14136,13891,35732,23237,80858,40230,13513,28040,35951,51992,44335,37634,28584,23885,10806,38167,17670,13159,19267,43224,24993,18713,18773,16205,18112,13532,12958,18172